"","ID","paragraphs","nchar"
"1","doc 9","ga: name greg anderson. social service supervisor st. louis county public health human services area chemical dependency services. employed st. louis county twenty-four plus years. bachelor's degree sociology minnesota state mankato. master's degree social work university minnesota duluth. born extreme southeastern minnesota. grew farm outside mable, minnesota, forty miles south winona. went high_school, graduated there. already described college life. born june 1956. ",623
"2","doc 13","ga: cover bases. case attorney calls sometime. ",57
"3","doc 15","ga: two_years winona first, transferred mankato state. ",66
"4","doc 17","ga: neither mother father does. sister degrees sociology nursing. ",91
"5","doc 19","ga: absolutely. growing sixties, early seventies small, rural town basically lot industry. primary business industry farming. position really take doo-doo. allergies things. position carry family farm, real clear. sister eight years older i. gone went nursing school mankato state university. that. needed move on, person-oriented person. handled calculus meteorologist. went look mass communication journalism, news broadcasting. spent time there. realized handle egos present area work, slipped sociology. got ba degree spent three summers summer rec program director mable canton communities. strong love—my first love outside family baseball. spend lot time following working. kind that. ",1048
"6","doc 20","got twin cities. 1978 1987 got married moved worked nursing homes. short-time activity assistant, activity director, spent probably eight years social service director. basically coordinated admissions, discharged planning, addressing psychosocial needs nursing home residents nursing home.",376
"7","doc 21","that, met wife moved here. realized lot job opportunities just sociology degree, one first graduating class members of—the advanced generalist program—msw program—at university minnesota duluth. umd basically discontinued msw program, start new program going advanced generalist generalist practice standard basic social work advanced education. really enlightening experience me, really unique school two_years class twenty something individuals basically one worked gerontology. everybody else children/family services. two three individuals dealing chemical dependency, substance use disorder type things. interest time continued geriatric, elderly, assisting supporting individuals going aging process. able assist support families. aging process evolving process grieving age transition. transition lose certain skills and/or certain access stages life, able deal go next phase life. one gets older, currently am, even realization understanding witnessed experienced early years. ",1433
"8","doc 22","got school umd. done internship children family service, time st. louis county social services. able internship county nursing home. finished that. later hired child protection worker. commuted year half hibbing, minnesota. hundred forty-four mile trip day work. eighteen months first child born opportunity work state minnesota minnesota veteran's home silver bay just opened. spent year working admission coordination. lot relationship discharge [unclear]. basically kind last phase life veterans veterans' spouses, meantime program also looking adding alzheimer's dementia unit program. ",883
"9","doc 23","year. starting train staff looked opening additional forty beds unit alzheimer's group, able return duluth get job chris jenson county nursing home discharge planner chris jensen adding new role rehab unit. internship experience established nice relationships nursing home, happy bring board. spent two half years nursing home. came realization—i loved work—but duluth st. louis county social services going employer probably rest professional career. needed come government service center get established here. came 1995. spent four plus years contract manager. basically working purchase service contracts various units divisions anywhere children family service group homes, home care agencies, board lodge programs, assisted living programs, chemical dependency treatment programs, mental_health centers. wide variety experiences within service areas. april 2000. ",1194
"10","doc 24","april 2000 decided needed change. needed experience, became adult foster care licenser. adult foster care licenser two half years, based encouragement received one two supervisors within department going succession plan, iconic adult service supervisor managing mental_health chemical dependency services fifteen twenty years—she iconic within human services community duluth st. louis county. looking retirement. filled position vacant two_years, took chemical dependency adult protection common entry point, represented pay services, responsibilities kind evolved switched, since january 2003 supervising chemical dependency services.",898
"11","doc 25","first twelve years just supervising services south st. louis county, ended restructuring time. took supervision st. louis county—both north south. got rule 25 assessors three different offices. also special project, generated county board's commitment support try find resolutions opioid epidemic. directing overseeing substance abuse prevention, intervention initiatives since probably april 2014. ",541
"12","doc 29","ga: coming 2003 primary substance choice alcohol. alcohol still seen number one. cycles trends changed. get later 2000s, maybe starting 2006, 2007 incredible upswing methamphetamine. basically dealing two different fronts. effect individuals family use, also public health crisis dealing manufacturing. lot money, lot resources put that. actually worked collaboration children family services unit financial assistance unit working setting shared family program basically mothers and/or parents dealing substance use placed adult foster home, actually end dually licensed foster home parent child placed together assist support initial phases recovery process. lot barriers place state perspective regards funding. funding adults, residential services called group state residential housing program significant effects minnesota family investment program, mfip. using 1) impacts others, get great detail right_now memory's kind faded. operated two three years, continuing barriers regards getting appropriate level funding getting families accept needing done financial assistance standpoint. ",1632
"13","doc 31","ga: yeah. monitoring, mentoring, types of—",48
"14","doc 33","ga: got frustrating. actually come position ongoing discussions past regarding trying parents dealing mental illness. continuation. barriers regards funding streams. state worked hard trying get things place relationship efforts reduce homelessness provide permanent support housing services. sure things may now changed. really taken look that. recent times looking projects relationship harm_reduction chronic inebriates face long-term homelessness. program called san marco, basically project modeled several communities within state minnesota, also throughout country. center alcohol drug treatment center city housing key players that. st. louis county public health human services provided supportive role development. worked assistance utilizing group residential housing financial assistance benefit provide funding individuals meeting characteristics. matter fact ten-year anniversary opening june 22nd. alcohol consumption a—",1362
"15","doc 35","ga: common term. kind shifted wet house supportive housing chronic inebriates. just another example collaboration commitment community can address it. wish still dvd—a dvd made think two_years opening—and called ""there losers,"" telling story. bring tears some. see can find office. law enforcement real, want say cynical, real concerns putting together, basically end dvd moving statement police chief regards program done individuals residing there, positive impact city community. ",787
"16","doc 37","ga: is. walk office, building, look one block san marco there. 230 west 3rd street. actually seventy units. thirty board watch component inebriates, forty single room sro units individuals. basically sro geared—we human development center community mental_health center—they provide supportive services individuals sro center alcohol drug treatment provides services individuals board watch. ",561
"17","doc 39","ga: lot resources allocated this. enhanced services children family services provide support, direction, intervention families afflicted issue. things kind of, well least standpoint, things fell wayside period time, think biggest thing law enforcement standpoint able focus reduce, ever totally eliminate, greatly reduce labs community. ",492
"18","doc 41","ga: yeah. duluth, rural duluth—",44
"19","doc 43","ga: yeah. can think least three four instances homes duluth. basically necessarily lower income areas occurring. boundaries relationship income. ",220
"20","doc 45","ga: really coming back. meth also very, prevalent. but, things really slowed probably, guessing, 2010, 2011. just_kind going along. dealing issues, things really coming light, things really becoming noticeable 2011, 2012. late 2012 commissioner department human services came duluth community leaders, believe police chief part panel presentation, want say lucinda jesson department human services commissioner time. long story short came discussing state's direction put together implement substance use state plan address substance use. ",738
"21","doc 47","ga: came st. paul. believe may been—i think minnesota department health think another state department along chief police time gordon ramsey. excited taking place. attended session along adult service division director mark nelson. time north st. louis county mcd supervisor mike [unclear], also attendance professor university duluth's school pharmacy mark sneiderhan, ceo center alcohol drug treatment gary olson, dr. faris keeling, dr. beth bilden essentia—at point st. mary's duluth clinic. treatment providers there, group started talking session, discussion led series meetings, basically first step development opioid abuse response strategies work group. overview. ",956
"22","doc 49","ga: yeah. point time primary concern focused prescription opioids. conversations came reviews, discussions, time went basically came greater monitoring control prescription medications. longer easily accessed, entrepreneurship others reflecting back supply demand basically said prescription medications, something will fit need will able provide price will good us affordable them. started swing shift heroin. ",596
"23","doc 50","second page references appearance two oars [opioid abuse response strategies] members, basically first substance abuse prevention intervention initiative team member [marsha gertel]. interviewed almanac north. almanac north spin-off almanac channel 2 twin cities. basically questions posed us kind went them. major heroin bust think day before—the date almanac north good friday 2014. major heroin bust either wednesday thursday week, based channel 8 called dana kazel, communication manager, wanting get response st. louis county relationship this. department contacted. adult service division director unable attend, basically went [marsha gertel] interview two hosts program.",972
"24","doc 51","oars group basically ended discussions leading proposal put together then—i think late 2000s—our public health department social service department merged public health human services. public health human services department proposed county commissioner's developing substance use prevention intervention initiative. unanimous vote january 2014 basically approved allocation four fte's provide prevention/intervention services throughout st. louis county address issues relating substance abuse. ",607
"25","doc 52","latest draft pamphlet brochure. can tell—yeah. [shows pamphlet] so, basically gives description relationship assisting supporting individuals, families, communities throughout st. louis county. will things public education, trainings, consultations within department family members others calling concerned wanting direction ideas.",453
"26","doc 54","ga: basically extension oars. oars program founded. oars came first. ",110
"27","doc 56","ga: think fair. basically looking at. ",71
"28","doc 58","ga: yeah. lot focus opioid piece. called expedited rule 25 assessments children family services. incredibly high rate home placement. kids foster care licensed facilities programs related parental substance use. parent parents come risk losing children. borderline crisis crisis. willing wanting assessment, oftentimes right one workers available, either [matt johnson] [marsha gertel]. also social worker north st. louis county. based hibbing, able go exactly day next day. happens quickly. ",762
"29","doc 59","let see can find [rustling papers]. minnesota department health put together annual—i can probably forward minnesota department health—it's basically data, statistics overdoses minnesota. county breakdown. basically broken things st. louis county 2015. 2016 statistics coming point, 2015 right_now. can take look overdoses related opioids. this based admissions licensed chemical dependency treatment programs. necessarily dealing individuals, admissions. ",636
"30","doc 61","ga: yeah, well know personal experience. ",53
"31","doc 63","ga: know something drinking water. mean something witnessed first came community 1987, just something just part culture value able work together support even though may agree various items values life. common purpose see problem needs solved can push differences aside work jointly collaborative fashion. submitted grant proposal department human services approximately 1.3 million dollars state targeted response opioid crisis. state minnesota received 5.3 million dollars 2017 2018 legislation pushed supported hard senator [amy] klobuchar address opioid crisis rural communities. ",867
"32","doc 65","ga: yeah. 5.3 million. ",23
"33","doc 67","ga: yeah. see can send powerpoint handouts will give even information. ",110
"34","doc 69","ga: submitted april 28th [2017]. st. louis county public health human service submitted proposal lead partner consortium duluth police department, lake superior drug violent crime task force, rural aids action network, center alcohol drug treatment, university minnesota duluth school pharmacy, six judicial district drug courts, carleton county public health human service.",430
"35","doc 71","ga: carleton county will receive financial benefit application, things will allow carleton county residents access particular things relationship drug court probably star component proposal development medically monitored opioid withdrawal program duluth detox. basically six-bed expansion duluth detox program, managed center alcohol drug treatment, collaborated helped facilitate san marco program. basically will individuals go medical withdrawal nurses doctors monitoring. will medication need. center alcohol drug treatment also clear path program, medication assisted treatment program, utilizes methadone suboxone. ",851
"36","doc 72","went significant borderline crisis situation back want say 2013. methadone program, want get sued say, methadone program called lake superior treatment center. basically going significant concerns issues relationship meeting licensing. state rule 31 licensing requirements. want say either 2012 2013 license revoked, put state minnesota crisis situation one five six programs company based state. state minnesota license revoked revoked programs parent company. closed lake superior treatment center ended closing think three four programs twin cities, one st. cloud, one rochester.",887
"37","doc 75","ga: yeah, long list, things set provider appeals revocation can maintain operation appeal process. appeal process went two plus year time period. initial onset meeting department human services state contingency plans something ended playing program closed. result collaboration oars group st. louis county put rop community based treatment program. received number proposals. ended personal presentations three finals area basically ended reviewing choosing center alcohol drug treatment. gary olson, ceo, talking putting something together four five years prior piece, raised level need. gary center just reflective collaboration efforts things. ",959
"38","doc 77","ga: here. non-profit. chief executive officer working dealing stuff thirty plus years. ",143
"39","doc 79","ga: yes. focusing community needs. gary adamant public health issue impact individuals' families overall community. reflective trying oars group. ",247
"40","doc 83","ga: yeah. meet every two months. next meeting june 15th. calendar allows can certainly—i can send appointment. meet second floor. really exciting time. based sent relationship grant proposal might hearing tomorrow whether not—they talking twenty-one days. tight timeline. state submitted plan january, basically programs supposed running july 1st. basically awards done contract negotiation piece awardees dhs. basically contract signed get things place july 1st. real interesting process. ",711
"41","doc 85","ga: rapid response overdose victims. collaborating duluth police, lake superior drug violent crime task force. jeff kazel can give lot detail that. particular piece looking expansion narcan naloxone access. able provide naloxone narcan training use substance. target law enforcement agencies throughout st. louis county. think sometimes get lost details—i'm sure also going possibly include emergency responders, definitely law enforcement agencies throughout st. louis county. ",646
"42","doc 86","going partnering substance use prevention intervention initiative social workers provide rapid response regard follow support. going try get see individual one two days. friday evening probably able anything monday. able get individual, provide rule 25 assessment, first step access treatment, provide alternatives supports may applicable necessary. trying establish contact early possible get things place provide support. ",627
"43","doc 88","ga: hoping will nice fit regards detox expansion. thing know need going exceed supply, duluth detox will able bring individuals provide place stay can get program. gary olson duluth detox going working north st. louis county range detox virginia [minnesota] able go range detox staying range detox going able brought duluth detox program. working ways, too. possible openings available. discussions transportation ely bringing people down. ",688
"44","doc 89","thing gets lost st. louis county geographically bigger three states within mainland. got large geographical area. another thing too, reminded regular basis too, st. louis county massive dealing services issues related urban rural settings. need able understand put things place address things areas. helps grown small farm able better connect understand things. always discussions about, ""this happens here. happens there."" “shouldn't same?” well, got apple got orange. make orange juice apple. make apple pie orange. although can apple juice orange juice. may great metaphor. ",865
"45","doc 91","ga: needs community effort, got got oars group. well documented throughout past four five years law enforcement judicial legal system arrest problem. need address prevention intervention standpoint. need provide support services individuals dealing addiction, need able outreach provide education support community better understanding addiction is, substances, drugs, can individual, process also communicate fact individuals dealing choice. dealing afflicted disease. ",800
"46","doc 92","one key points trying work constant basis stigma. need able remove stigma associated chemical dependency addiction. similar effort needs done regards mental_health. stigma hard individual come say, ""i'm addicted heroin. need help,"" many signs reactions people_like, ""oh, get here. worth anything. want to. making bad choices want to. just_get here. time help you."" type thing. ",632
"47","doc 93","think progress made. just discussions experiences, fortunately first-hand experience this. blessed far family. listening others seen going others, spouse, child, sibling, see understand fact choice. that—that_just amplifies importance support groups nar-anon verne wagner involved mutual experiences people share. ends snowball like_good things going grow passing information communication. need address things prevention intervention prevention. going solve lot just addressing one thing. reactive instead proactive both. ",916
"48","doc 95","ga: basically learned job. life experience, too. younger days twin cities social active lifestyle relationships individuals started great sudden like a, b, c, d. good. ended leaving relationship getting another relationship sudden thing starts happening. like, wow. interesting piece—i established good friendship one particular individual grad school part cd [chemical dependency] group veteran's hospital. listening stories individuals dynamics tied relationship addiction. hearing kind explained earlier life experiences. ",776
"49","doc 96","basically work. matter child protection working elderly: chemical dependency addiction_going part work. one things working department standpoint substance abuse prevention intervention initiative attempting put substance use disorder training core training function new social workers, new employees coming department. yet, getting much closer. wonderful training department within st. louis county. done lot work basically getting quarterly trainings set up. parental substance use disorder, abc's addiction. sbir [screening, brief intervention, referral] training—which brief intervention referral treatment—which screening piece can done anybody. need ph.d. master's. need college education able this. basically able ask open ended questions allow individual share able listen situation develop enlightenment risks involved. individual can easy saying, well, need get someone drive home night. or, phone numbers call. think really good get assessment see possibly might eligible chemical dependency treatment might good direction go. ",1523
"50","doc 98","ga: tough uncomfortable conversation, conflicting values installed us. ",121
"51","doc 100","ga: absolutely. part program, call 'sappy program' trying get, still work this, basically able to—we've experiences school districts throughout st. louis county. worked trying provide support, sbir training, employment agencies. ",328
"52","doc 102","ga: screening, brief intervention, referral treatment. referral treatment necessarily going chemical dependency treatment, referring services. can find lot information sbir. best practice established ers, necessarily substance abuse. can useful tool. something encourage. done sbir training now two_years now within st. louis county social workers, probation officers, public health nurses. ",487
"53","doc 104","ga: trying expand professional personal toolbox. ",57
"54","doc 106","ga: contagious. basically energy commitment others work display regarding this. can take credit interview. situations talking someone really sure purpose intent, get little guarded concerned saying it. matt johnson, one social workers, fifteen minute radio piece kdal 610 last wednesday. tom hanson, radio person working with, bouncing weather international news local news type thing, went way just conversation establish personal type atmosphere. things started—it often happen matt got done interview felt really good doing, said, communicated. ",911
"55","doc 108","ga: important. time get chance share others experience read expansion extension doing. got information card going start producing. law enforcement will raan [rural aids action network] basically individuals kind two sides—it's resources: range treatment center, center alcohol drug treatment, united way 211 information referral. key piece. inside going risk reduction points: always use clean needle, use with—harm_reduction safety points. blanking key points. forward stuff. minnesota department overdose reports.  ",740
"56","doc 115","chanhassen, minnesota",21
"57","doc 116","janie bining colford-jbc",24
"58","doc 121","jbc: sure. janie bining colford, give permission record this.",79
"59","doc 123","jbc: sure. grew country outside cincinnati, ohio farm. mostly grain farm, cows pigs chickens. one three girls. although half-brother affair father had. pretty normal farm girl childhood. went claremont northeastern high_school. horticulture degree worked horticulture field number years. moved minnesota worked, think twenty-one maybe, moved minnesota. worked landscape, lawn care company roseville. albrecht landscaping, actually. just summer. decided horticulture wasn’t really good year-round thing minnesota. started working prudential.",733
"60","doc 124","came here—actually maybe key story. came minnesota guy met college, sort engaged to, although think kind fling, came chemical dependency training. got treatment stayed here. moved lasted maybe month. another guy lived with, also treatment, started dating. ended getting married two kids. ex-husband father two older boys. recovery number years, although now drinks smokes. far know that’s all.",629
"61","doc 125","don’t_know else want know. twenty-five twenty-six oldest son. two_years later chance. now three children second husband.",187
"62","doc 127","jbc: think got married 1989. got divorced 1997. split 1983.",81
"63","doc 129","jbc: ‘93. yes, ’93, long. [laughs].",47
"64","doc 131","jbc: no, probably year half—i week every weekend them. switched week week. moved town in. able make work, school district everything. [side conversation].",314
