"","ID","paragraphs","nchar"
"513","doc 749","met husband here. recovery. got two_years do. left minneapolis moved back time moved here. got a--was volunteering, running aftercare miller-dwan still program. school master's social work in-take counselor--or a, in-take counselor. call it? anyway, trauma counselor veterans ptsd. veteran ptsd. combat vet. met volunteered thing. new year. dated year. lived together year, married since 1993. daughter came seven said, ""what going call rob?"" said, ""what mean?"" says, ""well, getting married."" ""yeah."" proposed me. said, ""you're getting married just rob anymore. going call him?"" said, ""kaitlyn, got figure yourself."" came back little goes, ""i call dad really hurt dad's feelings. going call 'pa'."" still calls pa. friends call pa. ",1216
"514","doc 750","went move leave california fifty-fifty legal fiscal custody really supposed take state. find tim. using. mother-in-law died. sent edge. three--he got full fiscal custody treatment legal record addict. then, visitation fifteen months old. three decided go treatment got full-time visitation. relapsed, mother died. felt guilty just went deep-end. even know was. week, maybe ten days was--i mean packed. ready go. got knock door him. says, ""i need help."" septic. blood poisoning system. arms like popeye arms. swollen. kept well. gave money kept well get place. got in. came going away party. signed papers let take her. forced sign papers. [laughs] clean ever since. think four years him, always let remember that. [laughs] good friends. made decision point time broken homes, made rope tug-of-war parents refused that. come stay us every christmas. husband kaitlyn go visit forth. two_years ago decided--he fully retired--he decided move back here, moved duluth. stand it. leaving, least got couple years daughter dad. really good. three parents. says three parents raise her. ",1852
"515","doc 751","done well, think come process. process feelings steps. irritated can go deal--it's problem. really problem. irritated problem, problem. get_go process bring back try talk can different whatever. made work. now daughter recovery stories enough. damn story. never saw us loaded. never saw us use. friends recovery. knew clearly addiction, got hooked meth young age. thirty-one now think four years. area chair. sponsors people. steps. guess family uses together can recover together too, right? use together! say that, know mean. ",948
"516","doc 752","sl: last thoughts?",22
"517","doc 753","re: can recover. hope. matter come. come hear message. hear messge know hope. think drug court done society great service allow convicts find way younger. stigma addict always addict runs deep. nice know women coming shame. reason society accepts males addicts easier females. ""good mothers children. wrong use?"" kinds things. lot shame attached. legal illegal. completely irrelevant. completely totally irrelevant. maybe put much anti-drug wars fighting legality put education creating fellowships people addictions. might cool thing. happening church. come walks. anonymity protecting last name. same. matter get cadillac city bus. matter. walk doors. anonymity important. doens't matter there. matters here. just another addict. good luck project. ",1395
"518","doc 754","sa: thank much. ",23
"519","doc 755","sl: thank much. ",23
"520","doc 764","ll: lori lewis give amy permission record this.",64
"521","doc 766","ll: born milwaukee, wisconsin. grew white bear lake, minnesota. great childhood. lot fun. dad alcoholic. oldest five. raised alcoholic situation. think nine ten separated. didn’t lack anything far love—my mom always us, always providing had. remember always loved fun even though oldest five lot responsibilities dad moved out. can honestly say good childhood.",582
"522","doc 767","went school white bear, graduated 1983 mariner last year split schools. anyways, great area grow in. fourteen kids always playing kick can something. really fun. good outside of—i saw lot things alcoholic family probably shouldn’t. know, helped develop person now.",379
"523","doc 769","ll: got remarried probably twenty think, unfortunately another alcoholic. marriage last long. maybe couple years. swore never get married hasn’t. just wonderful lady. positive attitude. very, strong, think that’s get optimism positive attitude. try look good things easily spiral down.",455
"524","doc 771","ll: yes. she’s seventy-four going strong. good. independent home.",83
"525","doc 773","ll: high_school tried college couple times wasn’t ready. [laughs] wound just working. worked couple different restaurants bartending waitressing. honestly, made much money back then. mom kept saying got go college!",266
"526","doc 775","ll: know! that’s went fun friends. bar scene back then, too. just fun. working bar called hog’s breath rice street, know is? packed every saturday anyway that’s met husband. but, wasn’t second child really took look life said, “okay, two young children here. going do?” bartending construction. started going school nursing.",536
"527","doc 777","ll: interesting no, idea interested healthcare field. ryan—would work different shifts. just wanted home. love mom. just wanted home kids. didn’t want miss anything. opened home daycare. ryan first grade, jenna kindergarten.",355
"528","doc 778","home daycare went school. get kids come morning. study. study naptime, study night. lock downstairs tell keith, “you watch kids.” driven wanted get a’s best.",340
"529","doc 780","ll: went evenings home kids. tough went part-time went st. kate’s nursing program. go full-time evenings. think_just kids—there always sick kids, nurturing them, figuring had. led nursing.",332
"530","doc 782","ll: started out, graduated back then, work nursing homes. started nursing home quickly moved to—they call sub acute unit. patients hospital quite ready go home. think now call transitional care. just loved that. remember one guy open chest wound, that’s wound wouldn’t heal. open heart surgery. open clean triple antibiotics pack just loved it. people_just couldn’t it. knew wanted go med surge. quickly transitioned went hudson hospital time worked med surg unit.",685
"531","doc 784","ll: yeah, post surgery. anything really can come med surg unit. hospital really small cross trained every area. wound working emergency room, funny ended working er doctor went school with. remember looking i’m_like, “are butch?” he’s like, “are lori?” really funny. went regions hospital really interested working bigger hospital. started working er there. third child. worked urgent care clinics hospital working like 5:00 pm 1:00 pm shift. transitioned ob, worked three years ago. back surgery can’t go_back nursing. could, floor. really bums love patient care.",895
"532","doc 786","ll: work isnt department computer programs for, don’t_know heard epic, it’s electronic healthcare. everything electronic. anaesthesia surgery. still really fun allows apply nursing need nurses physicians—all kinds people take clinical piece bridge gap technical people_just focused computers. nice gives another avenue apply skills still connection healthcare. love go_back nursing. miss ob nursing.",582
"533","doc 788","ll: no, don’t_know did. mean one kids eleven pounds twelve ounces.",90
"534","doc 790","ll: yeah. i’ve ended another surgery since then. two within last four years. said probably shouldn’t go_back. women c-sections three hundred pounds lift help them. but, know what, love job i’m someday—even phone triage—i love education piece nursing, loved ob think.",426
"535","doc 792","ll: new moms, yeah.",24
"536","doc 794","ll: oh yeah! doesn’t love that?",39
"537","doc 796","ll: well were—i say ‘we’ husband—we invovled kids. focus. come family five wanted big family just loved it. much fun that’s wanted kids experience. focus. someone wanted us go dinner something, good bad? probably not—we needed time alone, too, something going kids that. whether sports swimming girl scouts, whatever. plus, fun. i’m really outgoing person like sit moms chat. know? so, was, time too.",674
"538","doc 798","ll: yeah, yeah. so, always involved them. always honest kids. open. times open: “quit nurse.” talk openly—",193
"539","doc 800","ll: ryan jenna year apart. ryan jenna kitchen making something eat ryan’s friend zach lived right street sitting here. started talking about, oh, class learning health sex education high_school talking diseases stuff. said, “that’s important. need wear condoms. want make sure ready. don’t_know_going happen heat moment,” zach beet red. just beet red. tall skinny curly, curly hair laughing hysterically. i’m_like, “what funny? guys talk house?” like, “no, love here!”",748
"540","doc 801","so, always open still are. always told kids, “don’t worry consequences something. somewhere drinking don’t feel safe—i don’t care duluth, don’t care—we will get ride home. always reach us.” kids, don’t. always told will consequences based action outcome, know can always call us will you.",474
"541","doc 802","even kids got older—the kids younger, ryan just_going nine wilson last son. years were—it funny told kids pregnant ryan said, “oh, that’s it. i’m never getting disneyland.” so, wilson year half ryan nine half took kids. younger much family. got older junior high high_school that’s see definite separation older two younger two.",562
"542","doc 804","ll: four, yeah. jenna daughter. twenty-four. cal twenty. wilson, youngest, sixteen. ryan twenty-five. definitely see separation. harder teenagers wanted go friends. younger two, still involved sports clubs groups. know what? mom, too, always knew—i thought knew—where kids were. doing. with. always parent got older call find out, talk parent going invited party pool party whatever. “who going there? many chaperones?” ryan’s friends knew, friend’s moms call knew it. even wilson now, he’s like, “mom, this!” i’m_like “wilson, will eighteen! want know are!”",959
"543","doc 805","i’m probably little_bit overprotective. controlling, yeah, learned control anything. except eat wear. [laughs] just involved kids.",200
"544","doc 807","ll: ryan junior year tartan. jenna sophomore. suspected smoking pot, never proof anything. one night came home work nursing working evening shift. like midnight heard something downstairs, thought, “oh i’m just_going_go check.” smoking pot downstairs. told comfortable enough house, smoking while. point went got husband dealt everything. wasn’t naive enough think going stop.",597
"545","doc 808","third time getting caught downstairs got outpatient treatment new connections st. paul. thirty-day treatment actually went school there, too. day long. thirty days went_back school finished year junior. whole senior year really uneventful.",351
"546","doc 809","time jenna wasn’t anything. fact, jenna dating big jock high_school. volleyball player. go parties come home i’m_like, “you guys just left hour ago.” “well, drinking left.” like “good job.” anyways, really uneventful. twenty moved girlfriend camille. yeah, think twenty. anyways, everything fine.",457
"547","doc 811","ll: tried college couple times. actually, just wound stopping going, frustrated me. didn’t want go_just come told us. now $4,000 now considered f’s didn’t go. kind petition thing really depressed time, too. happening time. got antidepressants, refused take. didn’t like putting pills body, interesting way things panned out.",506
"548","doc 812","went_back, tried again, just didn’t like it. actually job hopped quite bit. he, though, talented. taught play drums, guitar, keyboards. photography, painting, drawing. content. wanted go school for. said, “well, let’s try that.” just never went_back. living girlfriend suspected pot smoking possibly stuff. confronted he’s like, “you know, don’t worry it. i’m own.”",575
"549","doc 813","never really thought anything. legal troubles, he’s working. started see decline girlfriend. ask us money rent couldn’t hold job. hindsight now, looking back, can see progression. one day called just_said, “you know_just_got phone ryan. he’s apartment. i’m really worried him. he’s saying nothing matters anymore. doesn’t want live.”",459
"550","doc 814","call sounded really bad. must day. don’t even remember. went apartment noticed cuts. me, just cry help. whether really trying. going ignore this. convinced go regions er. visit found benzos system narcotics.",378
"551","doc 815","find took back surgery.",61
"552","doc 817","ll: pain meds. so, oxycontin. no, oxycodone. went look sure enough gone, don’t_know many there. back surgery needed much andn didn’t lock up. didn’t think to. so, whether using realized realized that’s started it. don’t_know. went_back home end november, think end december, january, like, “you know what? things stressful. haven’t found steady job.”",556
"553","doc 819","ll: nope, been—because graduated 2009—must around 2012. so, fine long time that. graduated high_school. went long time. couple years. but, anyways, said, “can camille dog,” 120 pound sheep dog, “move can get caught stuff?” said, “sure, long right reasons. will get job.” and, girlfriend, always loved her. comes every while. dog, everybody loved dog.",547
"554","doc 820","end time—they moved end january—i noticed couldn’t even conversation ryan. so, moody since womb. that’s just type kid is. really, really moody john. lost lot weight, looked pale, sick lot. never expected, know—we question, using anything? never thinking heroin, know, using narcotics again, going here? went while.",492
"555","doc 822","ll: no, don’t bother it. get really irritated. leave. so, get sick he’s like, “i’ve enough this. i’m_going move out.” moves buddies. don’t want—we want make sure. “i know bind, too,” said, “you’re welcome stay can find place.”",344
"556","doc 823","so, loved her. just_really good gal. but, shortly that, brought laundry me. dropped buddies picked thought laundry, that’s found needle. like, “what hell going_on?”",286
"557","doc 824","so, call camille she’s like, “you know what, can’t get hold either,” trying get friend his. phone call suspected using well, found later well. actually knew using. know what? didn’t_know do. twenty-two. flat said, “we’re coming plan. three us going take will take duluth week.”",515
"558","doc 826","ll: brains aren’t developed. don’t_know. one friends really hard time, brent. couple times. comes divulges. feels tremendous guilt, understand. two friends just two weekends ago sat four hours talking. twenty-four year old men wanted talk to, know, much fun. tears stuff, too. think it’s good talk, helps work guilt.",533
"559","doc 827","point, found needle—i don’t remember details just crisis mode. took er. took st. john’s time. know_going withdrawls time. still actively using. er doctor going discharge him. went go bathroom told er doc, “how can discharge him? he’s going withdrawls. testing. know using something. can’t detect heroin. comes narcotic. discharge son here, will probably die will hold responsible. don’t care do.” went talked ryan put seventy-two hour hold. left irate upset. figured best thing just leave while. get call husband. discharging him, couldn’t believe it. couldn’t believe it.",918
"560","doc 828","wound going discharged him. came plan, talked social worker. social worker, talking him, said, “he needs inpatient treatment.” i’m_like, “yeah, er doctor going discharge him.” tried look bed. probably know nothing. think hibbing closest one, couldn’t get three weeks. took home, helped go withdrawls. watched whole weekend. called said, “we can get in. opening outpatient treatment st. john’s. like_that?” well, “sure,” continued look bed. well two weeks, wound getting call. going outpatient treatment. seemed okay, emotional though, crying lot, thought, “okay, working things,” still using. so, wound er sick withdrawals. so, said need kick teatment using.",1036
"561","doc 830","ll: yes. stuff happened found using around june. must 2013 now, yeah. again, beds open anywhere. so, wind going to, road here? can’t remember called. canvas health. so, he’s intense inpatient treatment evenings can continue work day job, really good job target. aa meetings.",427
"562","doc 831","so, went okay while. then, october relapsed. relapsed, continuing using. point called st. john’s said, “this ridiculous. need find bed son. don’t care do.” sat counter called every ficken inpatient facility. mean even outside minnesota. trying find, beds.",387
"563","doc 832","so, anyways just frustrated. wound getting ahold—at point didn’t even care insurance covered it. wound getting hold hazelden. actually somebody leaving bed. didn’t anybody waiting list, found odd. sitting here. everything happens friday like, “i need get weekend son.” anxious parent. phone interview him. phone interview me. got monday chem dep [chemical dependency assessment] nobody take anybody without chem dep assessment. trying find someone chem dep. quite frankly, heathpartners, good insurance. know ins outs, still battle.",797
"564","doc 834","ll: knew call. knew back door numbers. like say, crisis. feel bad parents don’t resources knowledge felt like trying deal this.",221
"565","doc 835","anyways, wound getting hazelden. time_like mid-october. in, course, twenty-one days. quite frankly time didn’t understand heroin. didn’t understand disease addiction. didn’t realize severe was. wish god somebody said honestly, counselors—and he’s hazelde! best place. one best places. wish said, “if son find recovery it’s matter he’ll die, when.” that’s harsh, but—and quite frankly it’s hindsight. frantic anxious? don’t_know back then—",644
"566","doc 837","ll: don’t feel like given enough resources. googling stuff.",75
"567","doc 839","ll: did. went parents siblings. four day—i asked kids go. jenna furious time. didn’t want go. didn’t find later, first day didn’t go. just begged go. said, “do know_don’t want go?” said, “of course not.” said, “he dealers calling phone get him. enough, mom.” upset him, too. said, “you know what, jenna? reason go.” went, beneficial. learned lot four day time. just even talking parents. good.",640
"568","doc 840","remember sitting down, too, group introduce even speak. just flood. crying hard heaving. wasn’t one. good. beneficial kids, looking back now just angry ryan disease putting everyone through. focus ryan year half. time jenna looking places live. giving time. cal graduating high_school. looking colleges. wilson wanted go creighton, different high_school hated tartan. unfair them, too. didn’t time attention. stressed out. couldn’t focus.",806
"569","doc 841","twenty-eight days. discharged home. time went visit him, too.",116
"570","doc 843","ll: plymouth first time, yes. thought age better teens young adults. tell every time went_back see looked healthier. sense humor back. laughing. interacting us. fun. gained twenty-five pounds think there. twenty-five pounds month. just looked really good.",396
"571","doc 844","discharged. must early october went early november now. within three days noticed going_on. confronted it.",176
"572","doc 846","ll: he’s home. later, find used night came home. stashed somewhere house. called up. went_back hazelden two-week time frame. time went center city. got discharged and—",262
"573","doc 848","ll: time put one starts b—",65
"574","doc 850","ll: yes. there. discharged vivitrol. gave vivitral shot left there. responsible finding place. go iop, intensive outpatient program, wasn’t going consistantly, ended getting kicked there, too. give vivitrol. like, “you nurse. can administer it.” asked counselor, said, “do know anything vivitrol? give son actively using overdose die.” i’m_like, “you urine test first. don’t urine test home.” again, crisis mode.",663
"575","doc 852","ll: it’s me. yes. ridiculous. called clinic woodbury. went vivitrol. sent back home. super pissed off: “they can’t vivitrol don’t even know is.” so, called nurse wound helpful. used work clinic. said, “let know can help.” i’m just balling. don’t_know_don’t resources. it’s ridiculous. wound getting us number valhalla place woodbury. ryan go there. urine test. must anything system gave injection. going while.",682
"576","doc 854","ll: no, just_get vivitrol shots.",39
"577","doc 856","ll: yes. good while. again, talking five six weeks january 3rd 4th. work got call daughter. said, “my car won’t start.” said, “is ryan home?” said, “yeah, must be. jeep here.” said, “go downstairs see can give ride.” within minutes calling me, frantic, 911 line. blue eyes bugging tongue sticking terrified. just_said, “hang me. way home. stay 911. will call eileen,” she’s next door neighbor. she’s nurse. came paramedics within minutes. met regions.",722
"578","doc 858","ll: believe given naloxone. time got er monitors everything constantly remind breath respirations go ten… six. alarm going off, beeping, one coming in. know work freaking alarm i’m silencing it. finally, go i’m_like, “do know alarm going constantly respirations six? silencing alarm.” said, “don’t that.” said, “well one coming in.” just whole experience.",565
"579","doc 859","wound leaving night advice doctors counselors. said, “you guys enabling him,” hard parent hear. true. like, “leave here. probably first time overdosed. needs figure need leave here. needs figure ride home.” husband left. january twenty below. terrible.",463
"580","doc 861","ll: er providers. counselor. er provider nurse. nurse wonderful. er before. find addiction treat like crap. don’t care. one really empathetic. just_like, “i’m sorry. see lot. best thing can right_now leave here.” heartfelt. monty came home showed got discharged. found friends came two weeks ago. mike one gave ride home. idea.",545
"581","doc 863","ll: yes. packed suitcase left door. thought going stay here. said, “ryan, can’t. everything suitcase. don’t_know_going_go.” monty night. sick stomach. frigid. people die that! wound staying friend lived two days called said, “can please come home?” said, “under conditions go_back treatment.” hazelden.",503
"582","doc 864","thing, too. didn’t_know options time. crisis mode go whoever bed open. don’t feel hazelden right place him. one reason follow twelve-step, faith-based. we’re spiritual, ryan spiritual but—we went church kids little, cramming throat. didn’t_know. just didn’t_know. got discharged one. said counselors, “i don’t_know go. feel like using home. shouldn’t coming home.” husband page whole thing.",661
"583","doc 866","ll: no. didn’t want go inpatient treatment. thought ryan aa meetings.",114
"584","doc 868","ll: no, ryan go. started going al-anon first time ryan in. first four five meetings, go ryan. sixth meeting like, “oh god i’m me.” learned lot myself. lot good skills use ryan.",281
"585","doc 869","fact, ryan said one time, kitchen, know tell talk the: “i feel, think, need.” started him. knew exactly that’s learn. said, “i don’t like changing.” argue him. give reason, really hard. practice this.",382
"586","doc 871","ll: tried get husband go. said, “the skills i’m learning working him. i’m_going around around argumentative circles like are.”",167
"587","doc 873","ll: yes. just funny though stood laughed, ryan i, said me. knew working needed keep going. go saturdays. go aa go al-anon.",233
"588","doc 874","end january around may—he sober long stretch time. girlfriend come back together. said, “i want make dinner someone tonight.” said, “oh, okay.” cut ties, even us. changed phone number. wanted nothing it. give credit. needs strong. said, “okay.” said, “i don’t money.” i’m_like, “oh, shit.” go, “i’m_going give cash here’s credit card is. can take go store, need receipt.” did. went, walk it’s camille. heart just—i happy. got back together time. really trying. loved much. kept telling said, “i know need yourself. worried back relationship her. don’t love her, you’ve got relationship know get right back faster. know mean?",1032
"589","doc 876","ll: using. yes. just loved him, too. can’t believe see going_on.",99
"590","doc 878","ll: no. found later yeah, friends over, smoke pot, take pills. ryan wound getting way hand. didn’t tell me. around may think started noticing again. sat ryan got back together like, “here deal. concerns. camille suspects anything will confront you. will tell me. will confront you. want support recovery.” everything, around middle may suspected using again. found later friends, don’t_know friends, dropped er. outside regions hospital overdosed.",732
"591","doc 880","ll: don’t_know details. left there. reason found got ambulance bill even regions er go outside building pick patient. call 911, situation before. guy outside regions heart attack call 911. something legal—that may 15th.",385
"592","doc 881","suspected got back hazelden june. time big change him. want there. getting anything treatment. depressed. terrible going there. angry. fourth july weekend camille went see him. talked counselor said, “he’s different. plan him?” he’s like, “he’s got want himself.” i’m_like, “i’m sick hearing this. i’m telling son_going die. you’re telling son needs rock bottom.” “like rock bottom death.” couldn’t.",639
