"","ID","paragraphs","nchar"
"1655","doc 2549","ap: three weeks. liked roommates. going iop, intensive outpatient treatment, new way. new way before. three years ago really changed. they’ve got new curriculum, new staff. it’s good hear many sources. really_liked it. odd died.",345
"1656","doc 2551","ap: he’s still suboxone. just_meeting psychiatrist. over; got first pass weekend spend time house aidan. see personality again, everything coming through. saturday night, night died, asked shave neck. shirt off. just taken shower gotten haircut didn’t like around neck. shaved looked see, nothing. just boy again. don’t_know happened.",536
"1657","doc 2553","ap: saturday night dinner us. gone new way saturday makeup session. met new girlfriend, maria. never met her. spent day wednesday. hours make new way saturday. spent friday night us, aidan. ball. left go new way, came back dinner. heard phone text messaging going around nine o’clock. said get back sober house ten, pass over. thought didn’t call sunday. said_going call. didn’t think anything it. probably four afternoon. really nice day sunday. spencer riding bike neighborhood kids here.",738
"1658","doc 2555","ap: aidan. groundskeeper church came driving girlfriend, know fairly well. he’s former coke addict. he’s really good friend greg’s. said, “come house something terrible tell you.” thought gotten kicked sober home. dean there. said, “spencer overdosed died.” called sister susan come right away jane. came claire called jamie. talked medical investigator. said really odd found needle next arm. face bathroom. first floor bathroom everybody coming going. jimmy door open, locked. syringe half full. said, “usually never find that. they’ve used whole syringe.” said, “we also found vomit pillow upstairs. we’re going full autopsy him.” told was…",977
"1659","doc 2556","[interruption due vacuum cleaner]",36
"1660","doc 2558","ap: said, “we also found two packets heroin wallet. we’re able lift dna it. we’ve got cell phone, too. happen know passcode is?”",177
"1661","doc 2564","ap: greg called dean’s cell phone couldn’t get ahold us. greg owner house. didn’t_know get hold us didn’t cell phones. that’s called friend church. able find address. came told us, girlfriend.",310
"1662","doc 2566","ap: aidan here, riding bike. just_goofing around him. told us, neighbor must watched him; idea taking care going_on. called sisters talked medical investigator. wondered passcode spencer’s phone. aidan given right christmas suspected using. knew using.",450
"1663","doc 2568","ap: spencer’s phone games it. aidan gave us passcode. able get phone go_back trace telephone numbers, trying find person interest. that’s emails showed you. that’s know_right_now. lived us last two_years. probably clean maybe six months. way figure probably started using last summer. benzos, heroin, pot, don’t_know using something heroin. call police twice come get acting goofy.",575
"1664","doc 2570","ap: waving around wanted take hospital. wouldn’t go us emergency room. just waving place. barely stand, barely talk. first time police took fairview detox. used seventy-two hour hold. “no problem based interview him.” one thirty morning get call kid u who’s found walking along light-rail tracks. fairview released him. obviously stomach pumped. don’t_know took. get medical records, haven’t done yet. christmas eve just disgusting. right church…",668
"1665","doc 2572","ap: previously used. just went like pancake pew. know packed usually is. whole family here, cousins, nieces, nephews. obviously used jamie kids, everybody here. refuse go upstairs. couldn’t bodily take up, weren’t strong enough. just sat there. whole family exposed him. said, “this just addiction is. act like.” dean said, “let’s just forget bothered it.” disease manifests as. one point sitting next niece said, “i don’t want way all. i’m sorry. just don’t want way.”",708
"1666","doc 2573","always wanted go treatment. never fought it. probably two_years ago, throw out. lived streets couple months. maybe even long. got beat up. finally called said, “i’m ready go treatment.” mom just_know wasn’t going recover. funeral planned head least last year, maybe even last two_years, amy. tearing dean apart. felt bad mother able protect marriage that. dean felt bad always get upset dean enabler. wrong happens? felt tremendous guilt don’t deal ramifications heroin use anymore. can’t tell feels like constant worry, constant pain time. pain him.",902
"1667","doc 2577","ap: remember first time going back nar-anon. walking door after, think christy, said, “i felt bad you. everybody went around circle don’t son anymore.” feeling i’m glad don’t go they’re going anymore. felt always inadequate dealing it; thought worked enough home. know processes are—i totally confused rule 25, never deal that. do, getting many conflicting answers? i’d get frustrated people talk phone use acronyms everything think knew. supposed know meant didn’t. frustrated dealing insurance, trying get ahold right person. frustrated dealing counselors different rehab facilities knowing put try help. give, gifts have.",1011
"1668","doc 2579","ap: couldn’t get understand going through. guess comes know little addiction know much it. it’s confusing me. mom never want mother go this, even living child still alive. fact, think it’s almost worse, unless they’re successful recovery.",385
"1669","doc 2581","ap: it’s always back mind. you’re never going_get rid feeling. want something get angry. it’s anger, felt numb angry last three months since he’s died. i’m angry can’t remember good parts it. i’m angry addiction parts him. felt numb. said, “how happened?” look pictures. be? disease insidious. often felt like, especially last six months went deep end using again, he’s dead body still working. like zombie.",608
"1670","doc 2583","ap: yes. even then. least august remember seeing therapist hazleton. gone different techniques. said, “i just don’t see need see anymore.” dean went_back knew break ties her, individual therapist, dean went her. dean spence went therapy fall and, tape, just nincompoop.",448
"1671","doc 2585","ap: spencer there, “don’t realize he’s using?” we’re sitting family therapy session.",93
"1672","doc 2587","ap: “can’t see signs? can’t pull this?” dean started seeing her.",98
"1673","doc 2589","ap: person saw. one three us. good one. just love her. able get dean enabling helping. looking back, i’ve many conversations director family program retreat now issue you’ve lost somebody, enabling, detachment. still don’t believe mat retreat.",406
"1674","doc 2593","ap: got point? really started buying twelve-step program. really felt really tied to, there’s nothing can change this. i’m just_going take fourth step here. truly believe order get healthy survive needed rely higher power. started becoming spiritual lot reading spiritualness; read lot karen hesse’s stuff. really reading able deal another person’s addiction. book, hearing speak, just attending step work thinking readings. just knew rely, me, god, higher power.",700
"1675","doc 2594","almost epiphany, remember one day woke morning just felt, knew black white: there’s nothing can anymore. there’s absolutely nothing can do. took long, long time get there. mothering doesn’t work, nothing, there’s nothing can that’s stronger heroin son. thing stronger god. thought can survive death. knew that’s going be, i’m just_going give god. think that’s felt detached. couldn’t anything. let god will spencer.",625
"1676","doc 2596","ap: yes, lot peace that. hear messages coming outside. that’s feel guilty mom. couldn’t part peace. i’m explaining well. part anymore. spencer higher power, god. knew nothing do. that’s hard mom say that.",357
"1677","doc 2598","ap: kind controlling person. hopefully i’m much anymore. that’s kind way brought be, controlling. regrets everything able do. regrets way all. much lot. know nothing do. great peace that. trouble remembering without drugs. that’s work next time, getting numbness anger that.",490
"1678","doc 2600","ap: first time since funeral i’ve brought out.",73
"1679","doc 2602","ap: shelley said, “mom, you’ve really got look make sure they’re okay put out.” last seven years look pictures, obviously using. wanted make sure weren’t obviously using pictures there. recorded phone right christmas, flopped couch, passed using, head cereal bowl.",410
"1680","doc 2604","ap: helped look that. might perpetuate anger. don’t_know feel right_now. i’m trying think else.",151
"1681","doc 2606","ap: joined other; they’re primarily mom sites, closed facebook pages parents loved ones addicts dead. one grass, national organization doesn’t chapter minnesota. it’s twelve-step program moms anybody who’s lost loved one. it’s primarily mothers. it’s just disgusting look at, it’s healthy site people vent.",397
"1682","doc 2608","ap: yes, many women moms can’t get it. show posts it. probably can’t get it. there’s another one compassionate friends, it’s way. find there’s little support people_like twin cities. there’s gloria’s group, dean can’t stand her.",316
"1683","doc 2610","ap: still don’t even know time spencer died at. says death certificate, says two afternoon, probably died that. greg couldn’t get ahold us, talked medical investigator talked greg. greg told us house spencer died. coming back church. didn’t get one. residents traumatized. twenty vehicles cornered off. police investigators interviewed eight them. said, “i don’t_know this. i’ve got traumatized people.” said, “we can come talk them.” greg said, “would you?”",700
"1684","doc 2611","dean shelley went monday night, day spencer died, always group meetings. packed. told told felt told happy spencer sober house. thankful there. told give hope, there’s much hope recovery. everybody crying. beautiful girl, absolutely gorgeous, just sobbing. saying, “i feel bad put parents through.” many said that. lot_people live sober home parents disowned addiction collateral damage addiction. soothing dean hear outreach gave. several came us afterwards told us much liked spencer, kind compassionate person was, really helpful me. that’s brought be. person found show everything show laying found. roommate show room. laid bed see see alive. helpful.",1220
"1685","doc 2613","ap: oh yes. we’ve back couple times now. met woman there, probably two three weeks ago, came said went fairview time spencer did. developed friend relationship. just wanted know impact spencer her. said, “i just remember jamie aidan just come back boy scout meeting. little boy scout outfit running around fairview recovery plus floor.” just hearing things, can think of, sometimes don’t want hear stories friends high_school stole something. i’ve heard bad last seven years just hear something good just nice.",724
"1686","doc 2615","ap: yes. wanted j. r., pastor, open addiction. gone.",85
"1687","doc 2617","ap: can give cd want.",42
"1688","doc 2619","ap: it’s you. kind addiction based sermon. just_said didn’t want sugar coat anything life, want celebrate life. good parts life. wonderful life addiction took over. kind two parts. good friend john talk. john talked lot younger days growing knowing struggles spencer went through. greg sober home guy, spoke addiction. lot_people sober home attendance. think four pews filled people.",588
"1689","doc 2621","ap: yes. several high_school friends attended said, “we just knew good guy spencer drugs took over. that’s memories him.” don’t_know many people; lot_people there. end, j. r. just gave; gave hands back kind thing said serenity prayers closing. powerful. j. r. gets pissed off.",395
"1690","doc 2623","ap: pastor. third heroin death since january.",61
"1691","doc 2625","ap: third fourth. church always hosts stuff retreat recovery stuff.",94
"1692","doc 2627","ap: it’s wayzata community, it’s ucc church. reason started going spencer’s addiction. friend mine goes, says, “you come service me. it’s calm soothing.” met building grounds guy there, who’s former addict.",289
"1693","doc 2629","ap: knew spencer spencer worked landscaping church one places accounts. it’s connecting dots. open; didn’t want cover anything addiction. dean shelley grown much open it. didn’t want spencer’s death anything different cancer diabetes anything else stigma attached it. there’s reason talk addiction part celebration life event.",495
"1694","doc 2633","ap: we’ve tried stay age appropriate him. we’ve always told since three dad brain disease. died told died sleep. mean wasn’t asleep guess technically. aidan quiet dad’s death. we’ve been, every occasion we’re him, tell spencer stories, funny stories. loves hearing that. went end year first grade picnic started talking one best friend’s dads. said, “this kid just told aidan’s dad died morning. knew kid class’s dad died. didn’t_know aidan’s died.” said, “what tell died of?” “brain disease.” morning little kid told father. said, “well, that’s told him, heroin overdose.” little kid’s dad special ed teacher minnetonka high_school deals lot kids terrible anxiety either relative’s addiction, parents, dealing themselves. totally got it. good conversation him.",1098
"1695","doc 2634","told boy scout leaders true cause. don’t_know to. jamie’s got name child psychiatrists, doesn’t feel need call yet. that’s probably okay. teacher school, he’s male first grade teacher good him. he’s wonderful. don’t_know_think. now feel, see dean, we’re parenting son. don’t_know that’s good idea. we’re grandparents.",459
"1696","doc 2636","ap: stays us like every three weekends jamie work weekends. try help throughout daycare financially we’re helping him. although one best things ever take life insurance policies kids babies. we’ve paying every year. recommend maddie brandon take insurance policy. think paid twenty-four dollars month years. thought stopped paying didn’t. now aidan social security. spencer never able financially support aidan, rarely. always it. it’s good couldn’t provide life can provide death now son. part mothering grandmothering take care aidan. want to.",790
"1697","doc 2638","ap: gets back damn enabling thing. enabling jamie? we’re helping her. don’t_know. just want get word vocabulary, detachment right_now.",178
"1698","doc 2640","ap: i’ve never heard anything read anything mothering child dies. enabling detachment aren’t good thing.",129
"1699","doc 2642","ap: heard mothers say that?",42
"1700","doc 2644","disease disorder mental illness, however want think addiction, everything can completely utterly acceptable expected. reason get twelve-step program whole codependency thing, think lot comes al-anon spouses addicts—that whole movement. care work beloved addict, become part problem instead looking addiction problem, lack resources, lack treatment, lack money, lack knowledge addiction problem. it’s mothers fathers wanting help children live side addiction. that’s i’m really, really thinking hard it’s working. yet, ask daughter, will say, “it nothing you, mom. thank giving me, stopped me.” that’s space need talk about.",963
"1701","doc 2645","ap: going back comment forcing allowing make decisions own. feel disease robbed spencer development frontal lobe. couldn’t reach point. make comment living streets, threw out, made realize needed treatment. best thing threw out. didn’t change grow anymore develop breaks brain things frontal lobe produces. don’t_know much brain science just i’ve taught. never survive that. never develop skills make turn around.",674
"1702","doc 2647","ap: thirty-four. tomorrow he’ll thirty-five.",47
"1703","doc 2649","ap: earth day i’m calling it.",37
"1704","doc 2651","ap: that’s came earth.",34
"1705","doc 2655","ap: helpful me.",36
"1706","doc 2659","ap: need keep coming back. sometimes feel like don’t fit anymore. need there. i’d like ask barbara. interview barbara?",152
"1707","doc 2661","ap: lost son three years ago. haven’t talked issue wanted explore that.",105
"1708","doc 2663","ap: enabling detachment everything. guess need think more.",90
"1709","doc 2665","ap: anyways, don’t_know told you, retreat finally grief support group. it’s starting august 20. don’t even know post it. going post facebook page. they’re people_like_me. i’m really curious see they’re going to; it’s twelve-step grief support, see goes.",331
"1710","doc 2672","minneapolis, minnesota",22
